{
  "$schema": "https://json-schema.org/draft/2020-12/schema",
  "$id": "https://kontur.local/schemas/rule.schema.json",
  "title": "Rule",
  "description": "Исполняемое правило матрицы. Текстовый trigger_logic из ТЗ компилируется в эту структуру и никогда не исполняется напрямую (ADR-0004).",
  "type": "object",
  "required": [
    "code",
    "section",
    "name",
    "matrix_version",
    "coverage",
    "applicability",
    "sources",
    "extractor",
    "comparator",
    "required_evidence",
    "review_priority"
  ],
  "properties": {
    "code": { "type": "string", "pattern": "^[A-ZА-Я0-9]+-[0-9]+$" },
    "section": {
      "type": "string",
      "enum": ["ПЗ", "СПЗУ", "АР", "КР", "ИОС1", "ИОС2", "ИОС3", "ИОС4", "ИОС5", "ТХ", "ПОС", "ПОД", "ООС", "ППМ", "БЭ", "ОДИ", "ЗУ", "СМ", "ИН"]
    },
    "name": { "type": "string" },
    "unit": { "type": ["string", "null"] },
    "matrix_version": { "type": "string" },
    "source_trigger_logic": {
      "type": ["string", "null"],
      "description": "Исходная текстовая формулировка из Приложения 1. Справочно, не исполняется."
    },
    "coverage": {
      "type": "string",
      "enum": ["executable", "extractor_missing", "source_missing", "advisory", "not_applicable"],
      "description": "Честный статус покрытия. Отчёт по матрице публикуется в этой разбивке."
    },
    "applicability": {
      "type": "object",
      "required": ["stages_required"],
      "properties": {
        "stages_required": {
          "type": "array",
          "items": { "type": "string", "enum": ["PD", "RD", "ID"] },
          "description": "Отсутствие нужной стадии даёт MISSING_EVIDENCE или NOT_APPLICABLE, но никогда не нарушение."
        },
        "object_types": { "type": "array", "items": { "type": "string" } },
        "condition": { "type": ["string", "null"] }
      }
    },
    "sources": {
      "type": "object",
      "properties": {
        "pd": { "$ref": "#/$defs/selector" },
        "rd": { "$ref": "#/$defs/selector" },
        "id": { "$ref": "#/$defs/selector" }
      }
    },
    "extractor": {
      "type": "object",
      "required": ["type"],
      "properties": {
        "type": {
          "type": "string",
          "enum": ["exact_field", "number", "enum", "set", "presence", "geometry", "contour_area", "element_table", "multi_field", "semantic_candidate", "room_compare"]
        },
        "passes": {
          "type": "array",
          "minItems": 1,
          "description": "Дополнительные проходы. number остаётся основным. room_pass добавляет атомарные находки по помещению и не подменяет число.",
          "items": { "type": "string", "enum": ["number", "room_pass"] }
        },
        "regex": { "type": ["string", "null"] },
        "anchors": { "type": "array", "items": { "type": "string" } },
        "normalization": {
          "type": "array",
          "items": {
            "type": "string",
            "enum": [
              "nfc",
              "collapse_spaces",
              "decimal_comma",
              "strip_unit",
              "upper",
              "multiply_dimensions"
            ]
          }
        },
        "dual_read_required": {
          "type": "boolean",
          "default": false,
          "description": "true для критических чисел и шифров: расхождение двух чтений даёт ABSTAIN."
        },
        "geometry_params": {
          "type": "object",
          "additionalProperties": false,
          "description": "Пороги обмера штрихов. Задаются до прогона, не подбираются по золотым строкам.",
          "properties": {
            "angle_deg": { "type": "number" },
            "min_overlap": { "type": "number" },
            "min_length_pt": { "type": "number" },
            "gap_min_pt": { "type": "number" },
            "gap_max_pt": { "type": "number" },
            "stamp_y": { "type": "number" },
            "read_tolerance_rel": { "type": "number" },
            "label_max_norm": { "type": "number" }
          }
        },
        "params": {
          "type": "object",
          "additionalProperties": false,
          "description": "Замороженные пороги обмера. Не подбираются по золотым строкам.",
          "properties": {
            "angle_deg": { "type": "number" },
            "min_overlap": { "type": "number" },
            "min_length_pt": { "type": "number" },
            "gap_min_pt": { "type": "number" },
            "gap_max_pt": { "type": "number" },
            "stamp_y": { "type": "number" },
            "read_tolerance_rel": { "type": "number" },
            "label_max_norm": { "type": "number" },
            "min_side_pt": { "type": "number" },
            "max_page_fraction": { "type": "number" }
          }
        },
        "room_compare": {
          "type": "object",
          "additionalProperties": false,
          "description": "Пороги сравнения помещений. Фиксируются до прогона gold, подбор только на неразмеченном объекте.",
          "properties": {
            "room_regex": { "type": "string" },
            "feature_regex": { "type": "string" },
            "bind_radius": { "type": "number" },
            "pair_jaccard_min": { "type": "number" },
            "max_differences": { "type": "integer" }
          },
          "required": ["room_regex", "feature_regex", "bind_radius", "pair_jaccard_min", "max_differences"]
        }
      }
    },
    "comparator": {
      "type": "object",
      "required": ["operator"],
      "properties": {
        "operator": {
          "type": "string",
          "enum": ["eq", "ne", "lt", "le", "gt", "ge", "range", "delta", "in_set", "not_in_set", "present", "class_not_lower"]
        },
        "value": {},
        "min_value": { "type": ["number", "null"] },
        "max_value": { "type": ["number", "null"] },
        "tolerance_abs": { "type": ["number", "null"] },
        "tolerance_rel": { "type": ["number", "null"] },
        "rounding": { "type": "string", "enum": ["none", "half_up", "half_even", "floor", "ceil"], "default": "none" },
        "unit_target": { "type": ["string", "null"] }
      }
    },
    "required_evidence": {
      "type": "array",
      "minItems": 1,
      "items": { "type": "string", "enum": ["expected", "actual"] }
    },
    "normative_refs": {
      "type": "array",
      "items": {
        "type": "object",
        "required": ["identifier", "clause", "effective_from", "layer"],
        "properties": {
          "identifier": { "type": "string" },
          "issuer": { "type": "string" },
          "clause": { "type": "string" },
          "effective_from": { "type": "string", "format": "date" },
          "effective_to": { "type": ["string", "null"], "format": "date" },
          "mandatory": { "type": "string", "enum": ["law", "bylaw", "mandatory_list", "voluntary", "contest_contract"] },
          "layer": { "type": "string", "enum": ["organizer_matrix", "current_overlay"] }
        }
      }
    },
    "failure_mapping": {
      "type": "object",
      "description": "Во что превращается каждый тип сбоя. Пустые и недостающие источники не становятся нарушением.",
      "properties": {
        "source_absent": { "type": "string", "default": "MISSING_EVIDENCE" },
        "not_comparable": { "type": "string", "default": "NOT_COMPARABLE" },
        "revision_conflict": { "type": "string", "default": "CLARIFICATION_REQUIRED" },
        "low_quality": { "type": "string", "default": "LOW_QUALITY" },
        "reads_disagree": { "type": "string", "default": "ABSTAIN" }
      }
    },
    "review_priority": { "type": "string", "enum": ["HIGH", "MEDIUM", "LOW"] },
    "tests": {
      "type": "array",
      "description": "Обязательные фикстуры правила: положительная, отрицательная, граничная и legal.",
      "items": {
        "type": "object",
        "required": ["name", "expected_status"],
        "properties": {
          "name": { "type": "string" },
          "inputs": { "type": "object" },
          "expected_status": { "type": "string" }
        }
      }
    }
  },
  "$defs": {
    "selector": {
      "type": "object",
      "properties": {
        "discipline": { "type": "array", "items": { "type": "string" } },
        "document_kind": { "type": "array", "items": { "type": "string" } },
        "table": { "type": ["string", "null"] },
        "description": { "type": ["string", "null"] }
      }
    }
  },
  "additionalProperties": false
}
