{
  "code": "ODI-119",
  "section": "ОДИ",
  "name": "Габариты и планировка санузлов для инвалидов (универсальные кабины)",
  "unit": "м² / м",
  "matrix_version": "draft-0",
  "source_trigger_logic": "Внутренние размеры универсальной кабины в РД/ИД < 1.5 м (СП 59.13330).",
  "coverage": "extractor_missing",
  "applicability": {
    "stages_required": [
      "PD",
      "RD"
    ],
    "object_types": [],
    "condition": null
  },
  "sources": {
    "pd": {
      "description": "Чертежи планировки санузлов (ОДИ)"
    },
    "rd": {
      "description": "Детальные чертежи санузлов (АР/ВК)"
    },
    "id": {
      "description": "Исполнительная схема санузлов (обмеры и привязки)"
    }
  },
  "extractor": {
    "type": "number",
    "regex": null,
    "anchors": [
      "Габариты и планировка санузлов для инвалидов (универсальные кабины)"
    ],
    "normalization": [
      "nfc",
      "collapse_spaces"
    ],
    "dual_read_required": true
  },
  "comparator": {
    "operator": "ge",
    "value": 1.5,
    "min_value": 1.5,
    "tolerance_abs": 0.0,
    "rounding": "none",
    "unit_target": "м"
  },
  "required_evidence": [
    "expected",
    "actual"
  ],
  "normative_refs": [],
  "failure_mapping": {
    "source_absent": "MISSING_EVIDENCE",
    "not_comparable": "NOT_COMPARABLE",
    "revision_conflict": "CLARIFICATION_REQUIRED",
    "low_quality": "LOW_QUALITY",
    "reads_disagree": "ABSTAIN"
  },
  "review_priority": "HIGH",
  "tests": [
    {
      "name": "equal_or_compliant_gives_no_difference",
      "expected_status": "AUTO_NO_DIFFERENCE"
    },
    {
      "name": "triggering_difference_gives_candidate",
      "expected_status": "CANDIDATE"
    },
    {
      "name": "required_stage_absent_gives_missing_evidence",
      "expected_status": "MISSING_EVIDENCE"
    },
    {
      "name": "parameter_not_applicable_on_object",
      "expected_status": "NOT_APPLICABLE"
    }
  ]
}
