{
  "code": "KR-058",
  "section": "КР",
  "name": "Толщина монолитной фундаментной плиты / ростверка",
  "unit": "мм",
  "matrix_version": "draft-0",
  "source_trigger_logic": "Уменьшение проектной толщины плиты в РД или по факту заливки (ИД).",
  "coverage": "executable",
  "applicability": {
    "stages_required": ["PD", "RD"],
    "object_types": [],
    "condition": null
  },
  "sources": {
    "pd": { "description": "Опалубочный чертеж фундамента (КР)" },
    "rd": { "description": "Опалубочные чертежи плиты; Разрезы (КЖ)" },
    "id": { "description": "Исполнительная геодезическая схема нивелировки верха/низа плиты" }
  },
  "extractor": {
    "type": "number",
    "regex": null,
    "anchors": [
      "Толщина плиты",
      "Толщина ростверка",
      "Толщина монолитной фундаментной плиты"
    ],
    "normalization": ["nfc", "collapse_spaces", "decimal_comma", "strip_unit"],
    "dual_read_required": true
  },
  "comparator": {
    "operator": "delta",
    "tolerance_abs": 0.0,
    "tolerance_rel": null,
    "rounding": "half_up",
    "unit_target": "мм"
  },
  "required_evidence": ["expected", "actual"],
  "normative_refs": [],
  "failure_mapping": {
    "source_absent": "MISSING_EVIDENCE",
    "not_comparable": "NOT_COMPARABLE",
    "revision_conflict": "CLARIFICATION_REQUIRED",
    "low_quality": "LOW_QUALITY",
    "reads_disagree": "ABSTAIN"
  },
  "review_priority": "HIGH",
  "tests": [
    { "name": "equal_or_compliant_gives_no_difference", "expected_status": "AUTO_NO_DIFFERENCE" },
    { "name": "triggering_difference_gives_candidate", "expected_status": "CANDIDATE" },
    { "name": "required_stage_absent_gives_missing_evidence", "expected_status": "MISSING_EVIDENCE" },
    { "name": "parameter_not_applicable_on_object", "expected_status": "NOT_APPLICABLE" }
  ]
}
