{
  "code": "PPM-105",
  "section": "ППМ",
  "name": "Ширина эвакуационных дверей наружных выходов",
  "unit": "м",
  "matrix_version": "draft-0",
  "source_trigger_logic": "Ширина дверного полотна в РД/ИД < 0.9 м.",
  "coverage": "extractor_missing",
  "applicability": {
    "stages_required": [
      "PD",
      "RD"
    ],
    "object_types": [],
    "condition": null
  },
  "sources": {
    "pd": {
      "description": "Планы эвакуации (ППМ)"
    },
    "rd": {
      "description": "Спецификация дверей; Детальные чертежи (АР)"
    },
    "id": {
      "description": "Паспорта на двери; Акты АОСР; Фактические обмеры"
    }
  },
  "extractor": {
    "type": "number",
    "regex": null,
    "anchors": [
      "Ширина эвакуационных дверей наружных выходов"
    ],
    "normalization": [
      "nfc",
      "collapse_spaces"
    ],
    "dual_read_required": true
  },
  "comparator": {
    "operator": "ge",
    "value": 0.9,
    "min_value": 0.9,
    "tolerance_abs": 0.0,
    "rounding": "none",
    "unit_target": "м"
  },
  "required_evidence": [
    "expected",
    "actual"
  ],
  "normative_refs": [],
  "failure_mapping": {
    "source_absent": "MISSING_EVIDENCE",
    "not_comparable": "NOT_COMPARABLE",
    "revision_conflict": "CLARIFICATION_REQUIRED",
    "low_quality": "LOW_QUALITY",
    "reads_disagree": "ABSTAIN"
  },
  "review_priority": "HIGH",
  "tests": [
    {
      "name": "equal_or_compliant_gives_no_difference",
      "expected_status": "AUTO_NO_DIFFERENCE"
    },
    {
      "name": "triggering_difference_gives_candidate",
      "expected_status": "CANDIDATE"
    },
    {
      "name": "required_stage_absent_gives_missing_evidence",
      "expected_status": "MISSING_EVIDENCE"
    },
    {
      "name": "parameter_not_applicable_on_object",
      "expected_status": "NOT_APPLICABLE"
    }
  ]
}
