{
  "code": "POS-088",
  "section": "ПОС",
  "name": "Точки подключения и мощности временных ресурсов",
  "unit": "кВт / м³",
  "matrix_version": "draft-0",
  "source_trigger_logic": "Превышение запрашиваемой мощности для строймашин над лимитом ПОС.",
  "coverage": "executable",
  "applicability": {
    "stages_required": [
      "PD",
      "RD"
    ],
    "object_types": [],
    "condition": null
  },
  "sources": {
    "pd": {
      "description": "Текст и графика ПОС: Потребители ресурсов"
    },
    "rd": {
      "description": "Рабочие схемы временных сетей (ППР)"
    },
    "id": {
      "description": "Договоры на техприсоединение; Акты балансового разграничения"
    }
  },
  "extractor": {
    "type": "multi_field",
    "regex": null,
    "anchors": [
      "Точки подключения и мощности временных ресурсов"
    ],
    "normalization": [
      "nfc",
      "collapse_spaces"
    ],
    "dual_read_required": false
  },
  "comparator": {
    "operator": "delta",
    "tolerance_abs": 0.0,
    "tolerance_rel": null,
    "rounding": "half_up",
    "unit_target": "кВт / м³"
  },
  "required_evidence": [
    "expected",
    "actual"
  ],
  "normative_refs": [],
  "failure_mapping": {
    "source_absent": "MISSING_EVIDENCE",
    "not_comparable": "NOT_COMPARABLE",
    "revision_conflict": "CLARIFICATION_REQUIRED",
    "low_quality": "LOW_QUALITY",
    "reads_disagree": "ABSTAIN"
  },
  "review_priority": "MEDIUM",
  "tests": [
    {
      "name": "equal_or_compliant_gives_no_difference",
      "expected_status": "AUTO_NO_DIFFERENCE"
    },
    {
      "name": "triggering_difference_gives_candidate",
      "expected_status": "CANDIDATE"
    },
    {
      "name": "required_stage_absent_gives_missing_evidence",
      "expected_status": "MISSING_EVIDENCE"
    },
    {
      "name": "parameter_not_applicable_on_object",
      "expected_status": "NOT_APPLICABLE"
    }
  ]
}
