{
  "code": "ODI-118",
  "section": "ОДИ",
  "name": "Высота порогов в дверных проемах на путях МГН",
  "unit": "м",
  "matrix_version": "draft-0",
  "source_trigger_logic": "Высота порога > 0.014 м (СП 59.13330).",
  "coverage": "extractor_missing",
  "applicability": {
    "stages_required": [
      "PD",
      "RD"
    ],
    "object_types": [],
    "condition": null
  },
  "sources": {
    "pd": {
      "description": "Текст ОДИ; Детали проемов"
    },
    "rd": {
      "description": "Детальные узлы сопряжения полов (АР)"
    },
    "id": {
      "description": "Акты АОСР на устройство полов (фактические замеры)"
    }
  },
  "extractor": {
    "type": "number",
    "regex": null,
    "anchors": [
      "Высота порогов в дверных проемах на путях МГН"
    ],
    "normalization": [
      "nfc",
      "collapse_spaces"
    ],
    "dual_read_required": false
  },
  "comparator": {
    "operator": "delta",
    "tolerance_abs": 0.0,
    "tolerance_rel": null,
    "rounding": "half_up",
    "unit_target": "м"
  },
  "required_evidence": [
    "expected",
    "actual"
  ],
  "normative_refs": [],
  "failure_mapping": {
    "source_absent": "MISSING_EVIDENCE",
    "not_comparable": "NOT_COMPARABLE",
    "revision_conflict": "CLARIFICATION_REQUIRED",
    "low_quality": "LOW_QUALITY",
    "reads_disagree": "ABSTAIN"
  },
  "review_priority": "MEDIUM",
  "tests": [
    {
      "name": "equal_or_compliant_gives_no_difference",
      "expected_status": "AUTO_NO_DIFFERENCE"
    },
    {
      "name": "triggering_difference_gives_candidate",
      "expected_status": "CANDIDATE"
    },
    {
      "name": "required_stage_absent_gives_missing_evidence",
      "expected_status": "MISSING_EVIDENCE"
    },
    {
      "name": "parameter_not_applicable_on_object",
      "expected_status": "NOT_APPLICABLE"
    }
  ]
}
