{
  "code": "POD-095",
  "section": "ПОД",
  "name": "Мероприятия по пылеподавлению и снижению шума",
  "unit": "—",
  "matrix_version": "draft-0",
  "source_trigger_logic": "Отсутствие систем гидроорошения или защитных экранов в РД при демонтаже стен.",
  "coverage": "extractor_missing",
  "applicability": {
    "stages_required": [
      "PD",
      "RD"
    ],
    "object_types": [],
    "condition": null
  },
  "sources": {
    "pd": {
      "description": "Текст ПОД: Требования к орошению/экранам"
    },
    "rd": {
      "description": "Технологические карты; Места водных пушек (ППР)"
    },
    "id": {
      "description": "Журнал производственного экоконтроля (замеры шума/пыли)"
    }
  },
  "extractor": {
    "type": "presence",
    "regex": null,
    "anchors": [
      "Мероприятия по пылеподавлению и снижению шума"
    ],
    "normalization": [
      "nfc",
      "collapse_spaces"
    ],
    "dual_read_required": false
  },
  "comparator": {
    "operator": "present",
    "rounding": "none",
    "unit_target": null
  },
  "required_evidence": [
    "expected",
    "actual"
  ],
  "normative_refs": [],
  "failure_mapping": {
    "source_absent": "MISSING_EVIDENCE",
    "not_comparable": "NOT_COMPARABLE",
    "revision_conflict": "CLARIFICATION_REQUIRED",
    "low_quality": "LOW_QUALITY",
    "reads_disagree": "ABSTAIN"
  },
  "review_priority": "MEDIUM",
  "tests": [
    {
      "name": "equal_or_compliant_gives_no_difference",
      "expected_status": "AUTO_NO_DIFFERENCE"
    },
    {
      "name": "triggering_difference_gives_candidate",
      "expected_status": "CANDIDATE"
    },
    {
      "name": "required_stage_absent_gives_missing_evidence",
      "expected_status": "MISSING_EVIDENCE"
    },
    {
      "name": "parameter_not_applicable_on_object",
      "expected_status": "NOT_APPLICABLE"
    }
  ]
}
