{
  "code": "PZ-018",
  "section": "ПЗ",
  "name": "Максимальный часовой расход газа",
  "unit": "м³/ч",
  "matrix_version": "draft-0",
  "source_trigger_logic": "Увеличение потребления газа в РД выше лимита, одобренного в ПД.",
  "coverage": "executable",
  "applicability": {
    "stages_required": ["PD", "RD"],
    "object_types": [],
    "condition": null
  },
  "sources": {
    "pd": { "description": "Раздел ПЗ: Текст (ТУ газа)" },
    "rd": { "description": "Раздел ГСВ: Лист \"Общие данные\"; Схема ГРП/Ш" },
    "id": { "description": "Акт приемки газопровода; Договор поставки газа" }
  },
  "extractor": {
    "type": "number",
    "regex": null,
    "anchors": ["Максимальный часовой расход газа"],
    "normalization": ["nfc", "collapse_spaces"],
    "dual_read_required": true
  },
  "comparator": {
    "operator": "delta",
    "tolerance_abs": 0.0,
    "tolerance_rel": null,
    "rounding": "half_up",
    "unit_target": "м³/ч"
  },
  "required_evidence": ["expected", "actual"],
  "normative_refs": [],
  "failure_mapping": {
    "source_absent": "MISSING_EVIDENCE",
    "not_comparable": "NOT_COMPARABLE",
    "revision_conflict": "CLARIFICATION_REQUIRED",
    "low_quality": "LOW_QUALITY",
    "reads_disagree": "ABSTAIN"
  },
  "review_priority": "HIGH",
  "tests": [
    { "name": "equal_or_compliant_gives_no_difference", "expected_status": "AUTO_NO_DIFFERENCE" },
    { "name": "triggering_difference_gives_candidate", "expected_status": "CANDIDATE" },
    { "name": "required_stage_absent_gives_missing_evidence", "expected_status": "MISSING_EVIDENCE" },
    { "name": "parameter_not_applicable_on_object", "expected_status": "NOT_APPLICABLE" }
  ]
}
