{
  "code": "PPM-107",
  "section": "ППМ",
  "name": "Класс пожарной опасности отделочных материалов",
  "unit": "Класс (КМ)",
  "matrix_version": "draft-0",
  "source_trigger_logic": "Подмена КМ0/КМ1 на КМ3 на путях эвакуации в РД/ИД.",
  "coverage": "executable",
  "applicability": {
    "stages_required": [
      "PD",
      "RD"
    ],
    "object_types": [],
    "condition": null
  },
  "sources": {
    "pd": {
      "description": "Требования к отделке стен/полов (ППМ)"
    },
    "rd": {
      "description": "Ведомости отделки (АР)"
    },
    "id": {
      "description": "Сертификаты; Пожарные декларации"
    }
  },
  "extractor": {
    "type": "enum",
    "regex": "[КK][МM]\\s?[0-5](?![0-9])",
    "anchors": [
      "Класс пожарной опасности",
      "Класс КМ"
    ],
    "normalization": [
      "nfc",
      "collapse_spaces",
      "upper"
    ],
    "dual_read_required": true
  },
  "comparator": {
    "operator": "class_not_lower",
    "value": [
      "КМ5",
      "КМ4",
      "КМ3",
      "КМ2",
      "КМ1",
      "КМ0"
    ],
    "rounding": "none",
    "unit_target": "Класс (КМ)"
  },
  "required_evidence": [
    "expected",
    "actual"
  ],
  "normative_refs": [
    {
      "identifier": "ФЗ № 123-ФЗ",
      "issuer": "Федеральное Собрание России",
      "clause": "Статья 13 (классификация строительных материалов по пожарной опасности, классы КМ0-КМ5)",
      "effective_from": "2009-05-01",
      "effective_to": null,
      "mandatory": "law",
      "layer": "organizer_matrix"
    }
  ],
  "failure_mapping": {
    "source_absent": "MISSING_EVIDENCE",
    "not_comparable": "NOT_COMPARABLE",
    "revision_conflict": "CLARIFICATION_REQUIRED",
    "low_quality": "LOW_QUALITY",
    "reads_disagree": "ABSTAIN"
  },
  "review_priority": "HIGH",
  "tests": [
    {
      "name": "same_class_gives_no_difference",
      "expected_status": "AUTO_NO_DIFFERENCE"
    },
    {
      "name": "better_class_in_rd_is_not_violation",
      "expected_status": "AUTO_NO_DIFFERENCE"
    },
    {
      "name": "lower_class_gives_candidate",
      "expected_status": "CANDIDATE"
    },
    {
      "name": "required_stage_absent_gives_missing_evidence",
      "expected_status": "MISSING_EVIDENCE"
    }
  ]
}
